<?xml version="1.0" encoding="UTF-8"?>
<!DOCTYPE project-record SYSTEM "../DAWTPC2/project-record.dtd">
<project-record>
    <project-data>
        <keyname>DAW-TPC3-2020</keyname>
        <title>Criação de um ficheiro XSLt para geração de um Website multi-página</title>
        <subtitle>Relatório do trabalho de casa 3 da cadeira DAW 2020</subtitle>
        <begin-date>Outubro 2020</begin-date>
        <end-date>Outubro 2020</end-date>
        <supervisor>
            <name>José Carlos Ramalho</name>
            <email>jcr@di.uminhp.pt</email>
            <url href="http://www3.di.uminho.pt/~jcr/">HomePage</url>
        </supervisor>
    </project-data>
    <workteam>
        <team-member>
            <name>Ricardo Silva</name>
            <number>84123</number>
            <email>a84123@alunos.uminho.pt</email>
            <url href="https://github.com/ricardoSlv">Github</url>
        </team-member>
    </workteam>
    <main-content>
        <abstract>
            <p>O trabalho de casa 3 correspondia à entrega de um ficheiro <url href="https://www.w3schools.com/xml/xml_dtd_intro.asp">Dtd</url> para validar um ficheiro <url href="https://www.w3schools.com/xml/xml_whatis.asp">Xml</url> fornecido e de um ficheiro <url href="https://www.w3schools.com/xml/xsl_intro.asp">Xslt</url> para gerar um website multi-página a partir do mesmo. </p>
            <p>O Website está dividido em 2 partes: <b>home-page</b>, <b>registos</b></p>
            <p>Através do Dtd pude que muitas das propriedades existentes para um registo não estão presentes em todos estes. Optei por por incluir apenas os obrigatórios no website com a exeção da informação cronológica.  </p>
            <p>É possivel navegar entre registos dentro do website, para criar esta fucionalidade usei os seletores: <i>following-sibling</i> e <i>preceding-sibling</i> de <b>Xpath</b> e gerei anchors para os ficheiros html correspondentes.</p>
            <p>Não consegui encontrar um solução para poder ordenar alfabeticamente os registos e ao mesmo tempo manter a navegação a funcionar</p>
            <p>Para melhorar a aparência do website decidi incluir o framework de css <url href="https://getbootstrap.com/">Bootstrap</url>.</p>
        </abstract>
    </main-content>
    <deliverables>
        <url href="https://github.com/ricardoSlv/DAW2020/blob/master/T3/arq.xml">arq.xml</url>
        <url href="https://github.com/ricardoSlv/DAW2020/blob/master/T3/arq.dtd">arq.dtd</url>
        <url href="https://github.com/ricardoSlv/DAW2020/blob/master/T3/arq.xsl">arq.xsl</url>
    </deliverables>
</project-record>